{
  "schema": "browser-profile/1",
  "id": "chrome-151.0.7922.173-linux64-stable",
  "browser": {
    "name": "Chrome",
    "version": "151.0.7922.173",
    "major": 151,
    "channel": "stable",
    "branded": true
  },
  "platform": {
    "os": "linux",
    "arch": "x86_64",
    "distribution": "ubuntu24/20260823.283"
  },
  "captured": {
    "at": "2026-09-02T02:23:31Z",
    "method": "host",
    "harness": "b-ids-harness 0.0.0",
    "operator": "github-actions hosted runner, capture.yml run 33582975294",
    "trust": "spki-pin",
    "resumption": "refused",
    "switches": [
      "--user-data-dir=(throwaway)",
      "--no-first-run",
      "--no-default-browser-check",
      "--disable-search-engine-choice-screen",
      "--disable-background-networking",
      "--disable-component-update",
      "--headless=new",
      "--ignore-certificate-errors-spki-list=BS+atVkB6ZX2P2ZIbZnESr63KyfYjY5ZbHQcFxTjurA="
    ]
  },
  "tls": {
    "record_version": 769,
    "legacy_version": 771,
    "session_id_len": 32,
    "session_id_hex": "91b90008138ce4fb810610bdc82392bd46c25238bc50d9647298d2defa1e96c8",
    "cipher_suites": [
      23130,
      4865,
      4866,
      4867,
      49195,
      49199,
      49196,
      49200,
      52393,
      52392,
      49171,
      49172,
      156,
      157,
      47,
      53
    ],
    "compression_methods": [
      0
    ],
    "extensions": [
      {
        "codepoint": 19018,
        "length": 0,
        "body_hex": ""
      },
      {
        "codepoint": 23,
        "length": 0,
        "body_hex": ""
      },
      {
        "codepoint": 45,
        "length": 2,
        "body_hex": "0101"
      },
      {
        "codepoint": 13,
        "length": 24,
        "body_hex": "001609040905090604030804040105030805050108060601"
      },
      {
        "codepoint": 35,
        "length": 0,
        "body_hex": ""
      },
      {
        "codepoint": 11,
        "length": 2,
        "body_hex": "0100"
      },
      {
        "codepoint": 17613,
        "length": 5,
        "body_hex": "0003026832"
      },
      {
        "codepoint": 43,
        "length": 7,
        "body_hex": "06aaaa03040303"
      },
      {
        "codepoint": 10,
        "length": 12,
        "body_hex": "000a8a8a11ec001d00170018"
      },
      {
        "codepoint": 65037,
        "length": 282,
        "body_hex": "0000010001cc002077894a5c5a2377bd21cc7ec35409a5709450a55c54194ff3e595657cc44d7a1500f0debc2e11075c46c3436a21f7ba70b584c48195ea679f640725851d34c02ba16ada2cfe286b76ee9905edfbed68e08f3fcfb0106931535c44b9fa9908412d95319fb5b6600e77bae3a22e80e6c5f5441e024ba8091a4431945a16d6a2c7754edf60270b3cbf2c7c0790e3a2d1bd95ef2cb430d944b45b07335658c31653f26ff98adebda8672ba852e11089620ecba07cb20eb51fb6483030ef83539d2771af78d9f6767c817f83e3b27d98bd9aad18972b96b4525a0a27ff722b46ac9f362887cad9b02841867e0aded683f2b666d4fe408c7e59c046f8579359234e2c42eb2fea7874625b62994578b94f9c2a5241ee"
      },
      {
        "codepoint": 18,
        "length": 0,
        "body_hex": ""
      },
      {
        "codepoint": 51,
        "length": 1263,
        "body_hex": "04ed8a8a00010011ec04c08cc895ba72735513bb280370f3fb0e367c07ec068f2b8a735349992c33944414568b392f6f209dbec3cdfaaa97c677113ce8042df7b295a79fc3e01e40821be8373baa8c3e13e2311d0aba1e12c51611645d367cfd76742c1b47ecf2620754833d008cb1a444941c0512c494ae2800fa47576b36af86e5952112740f4a6a093b89813b25a5e165f07593a261bc4373106127b74cc67cf8da7ed404431a01b7db2168e9454d6d2bcf041796123765657211bfc805a9677f3cc81e38544c0a6323159c663ee87c243a5c4748197a90c14610077a823424a21c9e70052829bc20b315458946ab5296dd01b8b4b4610c474260146e584367ea99792316ace70b94cb6c079a8cb358528d90c652f3e18b8859476e98c8e3d734e473b4573a89bf290d09f658350576cad725eb84651d7837aff227be946f6d7b653bb704cfd2afa7d5ad8c4c3ab7c8cac7a686ac2c58eab1424a1672fc88907c82c0e6d722fef9604b8cc7ce39a57a90a1465b2ac1685c2664af325b8397b18c6d0887bf2572bc4105541b8d9d8c4f4c3565a3b8cacbbb61da6370283c7de15a8439056c03480cf821340cdb4540a08c71d51ce6966a5d1b6ed72600136c36034c57b509ba07d83df02b304f89204f686254bc50431c9c806a8206598d6622664238b916472fa36c98b86a2587c8a9d4940e00b78efe05651e19c71f27ae6d831c76b98ec91469e4b5c4c6160437a98efb2b2ccce52c4b291b2033262ea3bad3eb93b1272003fa26c032ad0233429cd438c1669519594337e1103d3983f4db09f522b4832cc8f7c89260b443c581a848b751e27586c317065df04c0dc21a93ab0b5f292154e0b4c22c73bcb79f11165a13e29835167cb8fa5dbc808fe8d196d8aa190e6182ff28b5fe92c6c2c8673642bf57f38c5d253d6051527c295465fcae778873ff571f0fb56a04f40d31314beb9cb95b084d59844a54b273c7ba9455aa503ab81b98e851c5913508aa111ae34e0dc98b9630523b26c4ff895a2c1432447036b4698f33c43d523301ba4787502a3393bb196de7b120b4bccd6761828ac314f16eab686d3ef05ba971a8d524a257343161d95f974c66e00a43b77761f46978af5a825e478c4d642351031d72f95d880657e2528129c2386105ae73dccffca922284907f8689bf7013a370c440ec10c0289a6d1f020ce40c3617b2607958876f97427a83c80223c2f594698d37c11d48c7126bf5b2394cec4c233506eaf81a991c00cd7e1c9d9fa65582b5be028b36b9c910c8b4bd3024d9ed5cff4c903f0ec2fba1b8c03cc24b9194d632b5000505f93380ddc1c187bc976502372cfd93c93391f64f8379622565142ce71607f81dc6ffadc930f4170ae818706c9576ed1c05b100827a1c6ae785cec694e720c0d9d78cffc145032004d739a5af1710c9b85af10e5b640d5261644c6ccf2809f1296d5c4841c4cceea9324f45677a0ba50cdeac6be7c95eaa7cc3ac7823d22c37fa1cd053202695b7f0880a13db39d8feb4825e11cb2c76d1b4645773a7f5e788d034544612029707c6c13e44689809009286d1ad57ffc4b74bcda1152f2969edb126bc6b7e0c81c9749415d6a6c7e96480de742d07083ed9c51ae148ab42e06c04e71ecb36506f35310664b2c76e7a6f50c49433c8e28e961f0c1dc39bceab2dc09829fcf248697a1e958529abb524deb1860c76f81c902c056001d002031bad4772900d38f8f8f2f15d7bccb5bb1f0cda33437c47a2df390406d866215"
      },
      {
        "codepoint": 27,
        "length": 3,
        "body_hex": "020002"
      },
      {
        "codepoint": 16,
        "length": 14,
        "body_hex": "000c02683208687474702f312e31"
      },
      {
        "codepoint": 65281,
        "length": 1,
        "body_hex": "00"
      },
      {
        "codepoint": 5,
        "length": 5,
        "body_hex": "0100000000"
      },
      {
        "codepoint": 47802,
        "length": 1,
        "body_hex": "00"
      }
    ],
    "key_exchange_groups": [
      35466,
      4588,
      29,
      23,
      24
    ],
    "key_shares": [
      {
        "group": 35466,
        "entry_len": 1
      },
      {
        "group": 4588,
        "entry_len": 1216
      },
      {
        "group": 29,
        "entry_len": 32
      }
    ],
    "signature_algorithms": [
      2308,
      2309,
      2310,
      1027,
      2052,
      1025,
      1283,
      2053,
      1281,
      2054,
      1537
    ],
    "signature_algorithms_cert": null,
    "alpn": [
      "h2",
      "http/1.1"
    ],
    "ech": {
      "mode": 0,
      "kem_id": 1
    },
    "padding_len": null,
    "shuffled": {
      "state": "unknown"
    },
    "grease": {
      "extension_positions": [
        0,
        16
      ],
      "values": [
        19018,
        47802
      ],
      "distinct": true,
      "bodies_hex": [
        "",
        "00"
      ]
    }
  },
  "http2": {
    "frames": [
      {
        "frame": "settings",
        "entries": [
          {
            "id": 1,
            "value": 65536
          },
          {
            "id": 2,
            "value": 0
          },
          {
            "id": 4,
            "value": 6291456
          },
          {
            "id": 6,
            "value": 262144
          }
        ]
      },
      {
        "frame": "window_update",
        "window_size_increment": 15663105
      },
      {
        "frame": "headers",
        "stream_id": 1,
        "has_priority_block": true
      }
    ],
    "stream_priority": {
      "exclusive": true,
      "stream_dependency": 0,
      "weight_wire": 255
    },
    "priority_frames": [],
    "pseudo_header_order": [
      ":method",
      ":authority",
      ":scheme",
      ":path"
    ],
    "connection_window": null
  },
  "http": {
    "variants": [
      {
        "variant": "navigate",
        "headers": [
          {
            "name": "sec-ch-ua",
            "value": "\"Not=A?Brand\";v=\"99\", \"Google Chrome\";v=\"151\", \"Chromium\";v=\"151\""
          },
          {
            "name": "sec-ch-ua-mobile",
            "value": "?0"
          },
          {
            "name": "sec-ch-ua-platform",
            "value": "\"Linux\""
          },
          {
            "name": "upgrade-insecure-requests",
            "value": "1"
          },
          {
            "name": "user-agent",
            "value": "Mozilla/5.0 (X11; Linux x86_64) AppleWebKit/537.36 (KHTML, like Gecko) HeadlessChrome/151.0.0.0 Safari/537.36"
          },
          {
            "name": "accept",
            "value": "text/html,application/xhtml+xml,application/xml;q=0.9,image/avif,image/webp,image/apng,*/*;q=0.8,application/signed-exchange;v=b3;q=0.7"
          },
          {
            "name": "sec-fetch-site",
            "value": "none"
          },
          {
            "name": "sec-fetch-mode",
            "value": "navigate"
          },
          {
            "name": "sec-fetch-user",
            "value": "?1"
          },
          {
            "name": "sec-fetch-dest",
            "value": "document"
          },
          {
            "name": "accept-encoding",
            "value": "gzip, deflate, br, zstd"
          },
          {
            "name": "accept-language",
            "value": "en-US,en;q=0.9"
          },
          {
            "name": "priority",
            "value": "u=0, i"
          }
        ]
      }
    ]
  },
  "digests": {
    "ja3": null,
    "ja4": null,
    "ja4_r": null,
    "ja4_ro": null,
    "akamai": null
  },
  "raw": {